{
  "id": "last_resort",
  "name": "Last Resort",
  "type": "Normal",
  "category": "physical",
  "power": 140,
  "accuracy": 100,
  "pp": 5,
  "priority": 0,
  "target": "single_opponent",
  "effect": null,
  "flags": [],
  "description": "Can only be used after all other moves are used.",
  "is_custom": false
}