{
  "id": "order_up",
  "name": "Order Up",
  "type": "Dragon",
  "category": "physical",
  "power": 80,
  "accuracy": 100,
  "pp": 10,
  "priority": 0,
  "target": "single_opponent",
  "effect": null,
  "flags": [],
  "description": "Boosts Attack/Defense/Speed depending on ally Tatsugiri.",
  "is_custom": false
}