{
  "id": "magnet_rise",
  "name": "Magnet Rise",
  "type": "Electric",
  "category": "status",
  "power": null,
  "accuracy": null,
  "pp": 10,
  "priority": 0,
  "target": "single_opponent",
  "effect": null,
  "flags": [],
  "description": "User becomes immune to Ground-type moves for 5 turns.",
  "is_custom": false
}