{
  "id": "revelation_dance",
  "name": "Revelation Dance",
  "type": "Normal",
  "category": "special",
  "power": 90,
  "accuracy": 100,
  "pp": 15,
  "priority": 0,
  "target": "single_opponent",
  "effect": null,
  "flags": [],
  "description": "Type changes based on Oricorio's form.",
  "is_custom": false
}