{
  "id": "sky_attack",
  "name": "Sky Attack",
  "type": "Flying",
  "category": "physical",
  "power": 140,
  "accuracy": 90,
  "pp": 5,
  "priority": 0,
  "target": "single_opponent",
  "effect": null,
  "flags": [],
  "description": "Charges on first turn, attacks on second. May cause flinching. High critical hit ratio.",
  "is_custom": false
}