{
  "id": "punishment",
  "name": "Punishment",
  "type": "Dark",
  "category": "physical",
  "power": null,
  "accuracy": 100,
  "pp": 5,
  "priority": 0,
  "target": "single_opponent",
  "effect": null,
  "flags": [],
  "description": "Power increases when opponent's stats have been raised.",
  "is_custom": false
}