{
  "id": "spit_up",
  "name": "Spit Up",
  "type": "Normal",
  "category": "special",
  "power": null,
  "accuracy": 100,
  "pp": 10,
  "priority": 0,
  "target": "single_opponent",
  "effect": null,
  "flags": [],
  "description": "Power depends on how many times the user performed Stockpile.",
  "is_custom": false
}